{
  "name": "Typography",
  "componentName": "typography",
  "status": "experimental",
  "description": "Componente tipográfico do tf.ds. Renderiza qualquer elemento de texto semântico via prop `as`, com escala de variantes (display, heading, body, label, caption, code, overline), cor, alinhamento e truncamento. Não é focável — é conteúdo de texto, não elemento interativo.",
  "props": [
    {
      "name": "as",
      "type": "\"h1\" | \"h2\" | \"h3\" | \"h4\" | \"h5\" | \"h6\" | \"p\" | \"span\" | \"label\" | \"legend\" | \"strong\" | \"em\" | \"blockquote\" | \"figcaption\" | \"caption\" | \"code\" | \"pre\" | \"kbd\"",
      "default": "p",
      "description": "Elemento HTML semântico renderizado."
    },
    {
      "name": "variant",
      "type": "\"display-lg\" | \"display-md\" | \"display-sm\" | \"heading-xl\" | \"heading-lg\" | \"heading-md\" | \"heading-sm\" | \"body-lg\" | \"body-md\" | \"body-sm\" | \"label-lg\" | \"label-md\" | \"label-sm\" | \"caption\" | \"code\" | \"overline\"",
      "default": "body-md",
      "description": "Estilo tipográfico aplicado."
    },
    {
      "name": "color",
      "type": "\"primary\" | \"secondary\" | \"disabled\" | \"onBrand\" | \"error\" | \"success\" | \"warning\"",
      "default": "primary",
      "description": "Cor do texto a partir dos tokens semânticos."
    },
    {
      "name": "align",
      "type": "\"left\" | \"center\" | \"right\" | \"justify\"",
      "default": "left",
      "description": "Alinhamento horizontal do texto."
    },
    {
      "name": "truncate",
      "type": "boolean",
      "default": "false",
      "description": "Trunca o texto com reticências em uma linha."
    }
  ],
  "variants": {
    "variant": [
      "display-lg",
      "display-md",
      "display-sm",
      "heading-xl",
      "heading-lg",
      "heading-md",
      "heading-sm",
      "body-lg",
      "body-md",
      "body-sm",
      "label-lg",
      "label-md",
      "label-sm",
      "caption",
      "code",
      "overline"
    ],
    "color": ["primary", "secondary", "disabled", "onBrand", "error", "success", "warning"],
    "align": ["left", "center", "right", "justify"]
  },
  "tokensUsed": [
    "font.family.display",
    "font.family.sans",
    "font.family.mono",
    "font.size.5xl",
    "font.size.4xl",
    "font.size.3xl",
    "font.size.2xl",
    "font.size.xl",
    "font.size.lg",
    "font.size.md",
    "font.size.sm",
    "font.size.xs",
    "font.weight.bold",
    "font.weight.semibold",
    "font.weight.medium",
    "font.weight.regular",
    "font.line-height.tight",
    "font.line-height.snug",
    "font.line-height.normal",
    "font.line-height.relaxed",
    "font.letter-spacing.tight",
    "font.letter-spacing.normal",
    "font.letter-spacing.wide",
    "color.text.primary",
    "color.text.secondary",
    "color.text.disabled",
    "color.text.on-brand",
    "color.text.error",
    "color.text.success",
    "color.text.warning"
  ],
  "examples": [
    {
      "title": "Título de página",
      "code": "<Typography as=\"h1\" variant=\"display-md\">Bem-vindo</Typography>"
    },
    {
      "title": "Parágrafo de corpo",
      "code": "<Typography variant=\"body-md\">Texto de apoio da interface.</Typography>"
    },
    {
      "title": "Texto de erro",
      "code": "<Typography variant=\"body-sm\" color=\"error\">Campo obrigatório.</Typography>"
    }
  ],
  "dos": [
    "Use a prop `as` para garantir o elemento HTML semântico correto (h1 para o título principal, etc.).",
    "Escolha a variante pelo papel do texto, não pelo tamanho desejado.",
    "Use truncate em espaços de largura fixa para evitar quebra de layout."
  ],
  "donts": [
    "Não use className para sobrescrever estilos — use as props declaradas.",
    "Não pule níveis de heading só para obter um tamanho — a hierarquia importa para acessibilidade.",
    "Não use a variante `overline` para blocos longos de texto."
  ],
  "analytics": {
    "analyticsDefault": "off",
    "supportedEvents": ["component_display"],
    "piiRisk": "low"
  }
}
